<?xml version="1.0" encoding="UTF-8"?>
<scientificPaper xmlns="https://github.com/milica152/XML_tim27"
 xmlns:xsi="http://www.w3.org/2001/XMLSchema-instance"
 xsi:schemaLocation="https://github.com/milica152/XML_tim27 file:/C:/Users/mica/Desktop/xml/milica/XML_tim27/schemas/scientificPaper.xsd" institution="DcqEMbJkLlWjSIpvt.qq">
    <metadata>
        <datePublished>2020-05-16Z</datePublished>
        <dateAccepted>2020-12-01Z</dateAccepted>
        <keywords>
            <keyword>JJb</keyword>
            <keyword>WQZ</keyword>
        </keywords>
    </metadata>
    <title>nXh9nJOB7HfU569K</title>
    <authors>
        <author xmlns:sp="https://github.com/milica152/XML_tim27" sp:id="s/ri/voc/uifse/asby">
            <name>uF</name>
            <surname>tfs</surname>
            <profession>hdrWTAFKHNXEk_7G_mtzVLR8</profession>
            <contact>G</contact>
        </author>
        <author xmlns:sp="https://github.com/milica152/XML_tim27" sp:id="t/d">
            <name>f5ErDkG7</name>
            <surname>GpKhaAw4bGzsVouZp</surname>
            <profession>_cglBdHcTaNjkT8NSdiw_Vx3mL</profession>
            <contact>AI3TtK</contact>
        </author>
    </authors>
    <abstract>
        <plainChapter xmlns:sp="https://github.com/milica152/XML_tim27" sp:id="w/jm/rq/ut/t">
            <title level="2041882251" fontsize="18149426" style="Ie7r-TC_s">LvidDMv-_NHs7.D</title>
            <text>
                <paragraph fontsize="1870715540" sp:id="x/xih" style="DOyDtzV4dj">oWoUobdSR0V5hApSIx</paragraph>
                <paragraph fontsize="956514933" sp:id="k/p" style="LP9ZEaYfpatqySX">aJYucXSddXW7khGwZN-5ZhcPDn9N9q</paragraph>
            </text>
        </plainChapter>
        <plainChapter xmlns:sp="https://github.com/milica152/XML_tim27" sp:id="e/o">
            <title level="1009589659" fontsize="1233669770" style="GBBAWK5rFkZmqU">iCdJq0Ovmb</title>
            <text>
                <paragraph fontsize="916933852" sp:id="ca/c" style="wUvf74sIkUkgLG04_JpJkAcKY">T46Kzx5mSDcidBEEoew</paragraph>
                <paragraph fontsize="871003355" sp:id="ap/kw" style="ukz-1jtSZgDAJ_M.lv9">tQMtFk0ymjs</paragraph>
            </text>
        </plainChapter>
    </abstract>
    <chapters>
        <chapter xmlns:sp="https://github.com/milica152/XML_tim27" sp:id="m/n">
            <title level="824973156" fontsize="861778521" style="nx8cjD9kOOgJvm5SKHslRoKZQT">Q6om6m4LfL</title>
            <text>
                <paragraph fontsize="753339711" sp:id="bvbt/v" style="Qbdlvc">Bu69Q.a4VoJbjzI9</paragraph>
                <paragraph fontsize="391360002" sp:id="x/k" style="R-">PDjMcrqP2HJW5k</paragraph>
            </text>
            <list sp:id="ni/m" style="UtzWfsI4p9kt_CB_-rcyQj5s" isOrdered="false">
                <listItem>WJV</listItem>
                <listItem>ftIPpvx5iZhQl4</listItem>
            </list>
            <list sp:id="c/t" style="lktCw-NIeWVp-" isOrdered="true">
                <listItem>mOBuPBMRPp</listItem>
                <listItem>pnOBqroTQ-_pJIw</listItem>
            </list>
        </chapter>
        <chapter xmlns:sp="https://github.com/milica152/XML_tim27" sp:id="r/m">
            <title level="2071899257" fontsize="1455240584" style="n7">d6_Fh_emu8sZezqqybcGv-0feL</title>
            <text>
                <paragraph fontsize="398947268" sp:id="wq/zqi/qndb/pmzcn/n" style="H4">YGNqwSQ6E1</paragraph>
                <paragraph fontsize="1756547112" sp:id="p/w" style="E33KTDW8WI1vwGNsAWQOf6J4_EOd6S">RlMBtaRF</paragraph>
            </text>
            <referencePointer sp:id="wo/el">hL</referencePointer>
            <table sp:id="q/i" width="662878250" height="198270980" measuringUnit="GL2ZVPa7FWky">
                <row ordinal="1895410277">
                    <cell style="X87Uh0USam0OxgjgheYajW0" ordinal="163877931">tcLjE6g</cell>
                    <cell style="hTZCyplchQgtggywFL7lwa" ordinal="760109051">iN6qfJoKvlbNe.VuuRM01O</cell>
                </row>
                <row ordinal="44031221">
                    <cell style="Egs48gFZUUhXsZLYnvNq7RIXMt0T" ordinal="1756744610">xI4vg</cell>
                    <cell style="a_Noj1G3hdvgrMtQN" ordinal="337648673">yMlFBuk</cell>
                </row>
            </table>
        </chapter>
    </chapters>
    <references>
        <reference xmlns:sp="https://github.com/milica152/XML_tim27" sp:id="e/zkho" year="2021-09-16" authorName="ir0ci38">
            <url>zTK</url>
            <name>Ax5a</name>
        </reference>
    </references>
</scientificPaper>
