<?xml version="1.0" encoding="UTF-8"?>
<scientificPaper xmlns="https://github.com/milica152/XML_tim27"
 xmlns:xsi="http://www.w3.org/2001/XMLSchema-instance"
 xsi:schemaLocation="https://github.com/milica152/XML_tim27 file:/C:/Users/mica/Desktop/xml/milica/XML_tim27/schemas/scientificPaper.xsd" datePublished="2020-11-13" institution="g.XbvBA5xu">
    <title level="1890482457" fontsize="1278296186" style="IMHfVFKH3B6btC">K</title>
    <authors>
        <author xmlns:sp="https://github.com/milica152/XML_tim27" sp:id="ID001">
            <name>exLT0bOPHp.Sa2LEaMrWWHybu0Yp1</name>
            <surname>LXAQqmqIB</surname>
            <profession>euadrAvoPNB</profession>
            <contact>F-pgP1KMCbAwpfFzS9ZPLAYZE91jNj</contact>
        </author>
        <author xmlns:sp="https://github.com/milica152/XML_tim27" sp:id="ID003">
            <name>w1cKxav.T1BeHwJZRRWKmohE</name>
            <surname>yLNo8</surname>
            <profession>CPkJJRNm2AWimiP6rvBtD</profession>
            <contact>Wxfr7eDCJy6y1NpMwhKnmjhIi</contact>
        </author>
    </authors>
    <abstract>
        <plainChapter xmlns:sp="https://github.com/milica152/XML_tim27" sp:id="ID005">
            <title level="1749186857" fontsize="830242032" style="tf57UofQicZ5NuzvdSENqyJfc.Q">kU2Hrdp</title>
            <text>
                <paragraph fontsize="688654653" sp:id="ID007" style="sXwdyV">d</paragraph>
                <paragraph fontsize="1202099488" sp:id="ID009" style="oS_dAh-yvVMRdGqgjhBIB0w">Behds</paragraph>
            </text>
        </plainChapter>
        <plainChapter xmlns:sp="https://github.com/milica152/XML_tim27" sp:id="ID011">
            <title level="988428659" fontsize="293716115" style="B">ZWES</title>
            <text>
                <paragraph fontsize="1845656999" sp:id="ID013" style="WuU4K">gjbbNbvfjP7K6FuxnanZpWjJu</paragraph>
                <paragraph fontsize="657852806" sp:id="ID015" style="DVnvtHl-">ayQHbGZRA</paragraph>
            </text>
        </plainChapter>
        <keywords>
            <keyword>bU_GxcA_U</keyword>
            <keyword>y24W8cmDLTQ-Hei-X</keyword>
        </keywords>
    </abstract>
    <chapters>
        <chapter xmlns:sp="https://github.com/milica152/XML_tim27" sp:id="ID017">
            <title level="2145917462" fontsize="448001037" style="OerjQ7Flr">gIio2HJYW-jmISlVou</title>
            <text>
                <paragraph fontsize="572252667" sp:id="ID019" style="G7kvziJp8Z9">b6p1nodMqB</paragraph>
                <paragraph fontsize="728034764" sp:id="ID021" style="W8QDr8dZ.4iFO0tKlG8">wDKREmYuoJq2L3x1TS</paragraph>
            </text>
            <list sp:id="ID023" style="eBKO_D" isOrdered="1">
                <listItem>H</listItem>
                <listItem>ceQcfBFv-rDbVwo</listItem>
            </list>
            <codeBlock sp:id="ID025">U93ykghNVTVBqILA</codeBlock>
        </chapter>
        <chapter xmlns:sp="https://github.com/milica152/XML_tim27" sp:id="ID027">
            <title level="1749150648" fontsize="2063691235" style="XU">H7tR2PIGZbfsIs</title>
            <text>
                <paragraph fontsize="313362599" sp:id="ID029" style="wX3UzW.YI7R7g8UbLJ">VOW5O0OkGDuLWrpMpHJ4</paragraph>
                <paragraph fontsize="2110789472" sp:id="ID031" style="IewbsV">VAY</paragraph>
            </text>
            <list sp:id="ID033" style="bkbiDly" isOrdered="true">
                <listItem>f7iB8rI7gKJiC.A88hIswF.ScH</listItem>
                <listItem>Yznm</listItem>
            </list>
            <image sp:id="ID035">
                <description>kJ1Ab</description>
                <concreteImage>65877970697279788575728881788985</concreteImage>
            </image>
        </chapter>
    </chapters>
    <references>
        <reference xmlns:sp="https://github.com/milica152/XML_tim27" sp:id="ID037" year="2020-06-29" authorName="ZyjKd-SV8">
            <url>fYwmsVwyf</url>
            <name>EXP</name>
        </reference>
    </references>
</scientificPaper>
