<?xml version="1.0" encoding="UTF-8"?>
<scientificPaper xmlns="https://github.com/milica152/XML_tim27"
 xmlns:xsi="http://www.w3.org/2001/XMLSchema-instance"
 xsi:schemaLocation="https://github.com/milica152/XML_tim27 file:/C:/Users/mica/Desktop/xml/milica/XML_tim27/schemas/scientificPaper.xsd" institution="A7fJj">
    <metadata>
        <datePublished>2021-02-21</datePublished>
        <dateAccepted>2020-04-11Z</dateAccepted>
        <keywords>
            <keyword>DpFdPI5_ZjBO5z.vCOLquCb0rVR</keyword>
            <keyword>H7aU</keyword>
        </keywords>
    </metadata>
    <title>Vtl1fAtMpBwLmC2xXFzDl4zf3V</title>
    <authors>
        <author xmlns:sp="https://github.com/milica152/XML_tim27" sp:id="y/nxah">
            <name>Lnt-LtI4maXa6qDgBVr7</name>
            <surname>RyUsg7h879LBYZGmJ</surname>
            <profession>WP8pUe_5Kbq4ZNwQfPi9psYgweL</profession>
            <contact>JngVYbGRVU-QN3bbuaRJJDH</contact>
        </author>
        <author xmlns:sp="https://github.com/milica152/XML_tim27" sp:id="pdm/eukbu/l">
            <name>K</name>
            <surname>j</surname>
            <profession>x1CkUo40L1LmBb</profession>
            <contact>g1yLi0s8_G4KrMdn</contact>
        </author>
    </authors>
    <abstract>
        <plainChapter xmlns:sp="https://github.com/milica152/XML_tim27" sp:id="yj/ae/ojv">
            <title level="820868349" fontsize="1937570622" style="F">GLrPwtUYRFcnfYLwm3MNOuBAVuT.1</title>
            <text>
                <paragraph fontsize="1405303253" sp:id="y/nhh" style="FBf7SkAMZVKN1B0GSvkL.N_bzJQY4">Kpl-B7J4SFPiS0bh</paragraph>
                <paragraph fontsize="676798426" sp:id="i/lm/ge/hmd" style="zxbdN.3zSfz95P1A5Sp74tk0">yGnQ0hc6Kvmt39tDugjCkY_rdab</paragraph>
            </text>
        </plainChapter>
        <plainChapter xmlns:sp="https://github.com/milica152/XML_tim27" sp:id="j/th">
            <title level="1144129006" fontsize="302009387" style="fyElKKGfNb">YcYnE1NZ2XSdMyqCO-</title>
            <text>
                <paragraph fontsize="941359764" sp:id="m/u" style="C2Qp1wlwMNEp4QX9u2j0FxzerR18q">De1T73nffpTZoNE-</paragraph>
                <paragraph fontsize="1070618682" sp:id="r/sz/wl/y" style="_E1vW0yoflJnVPfLBdBq2DBjFd55xc">P8</paragraph>
            </text>
        </plainChapter>
    </abstract>
    <chapters>
        <chapter xmlns:sp="https://github.com/milica152/XML_tim27" sp:id="b/ekbq">
            <title level="697997016" fontsize="203694469" style="Xc0DpJTo">ilmpYYHXvsudJgypffH_</title>
            <text>
                <paragraph fontsize="791671483" sp:id="jxsq/km/bm/nzda" style="c1gUXh">qd0NJfiHXLfcRDlkXZH7BaSoqQhLqx</paragraph>
                <paragraph fontsize="767224137" sp:id="q/whdp/td/jqieq/r" style="CgAV.oR">lbz5</paragraph>
            </text>
            <codeBlock sp:id="qufm/xua">WAKZ0h1nJccHfe3KoLevtg</codeBlock>
            <referencePointer sp:id="p/kdxhz/ik/tibxc/gifw">NknoPWV.eTzqeJ_qTAv</referencePointer>
        </chapter>
        <chapter xmlns:sp="https://github.com/milica152/XML_tim27" sp:id="s/feq">
            <title level="2047444639" fontsize="892071150" style="cpIF5MLHw.7nf2lxxEwr9wCMXq">SsA9cuIE-GWd</title>
            <text>
                <paragraph fontsize="2118747350" sp:id="ohm/sp/t" style="m.mfFa">kkflFMUa7vjQjk</paragraph>
                <paragraph fontsize="232804275" sp:id="qkar/y" style="BliLB9fMVKfZ-87XtPZ6pRoWNOWLpe">rsl4HdHLxQYHcn</paragraph>
            </text>
            <table sp:id="y/l" width="233517969" height="1617135835" measuringUnit="gqE5k">
                <row ordinal="1225310860">
                    <cell style="LUvO-eVniDB_-q" ordinal="1452057127">R9T54FqiwqLODQB-yFQ9o8iJfKhZ</cell>
                    <cell style="pLt8" ordinal="1781743024">VrbToHddVo_-oEpkxFcfwn</cell>
                </row>
                <row ordinal="1794178009">
                    <cell style="FsBA-dKb_A9TZScooguhap" ordinal="1196596486">q24ymK8kt74.</cell>
                    <cell style="EV2c0sRYZmGY_O" ordinal="339090690">mtW5Z9OXuw9YsD</cell>
                </row>
            </table>
            <list sp:id="fnu/laaj" style="hiEX71VzaOq2t" isOrdered="false">
                <listItem>ND4ZW9FS</listItem>
                <listItem>i57qZCobRpH3RUjcrLH9uBkAeA9bI</listItem>
            </list>
        </chapter>
    </chapters>
    <references>
        <reference xmlns:sp="https://github.com/milica152/XML_tim27" sp:id="c/wch/k" year="2020-03-28Z" authorName="IRXQ8eGseqs6FxtappSouXxE">
            <url>_p</url>
            <name>UoKkw7SoGQRdaq7kMFxY72</name>
        </reference>
    </references>
</scientificPaper>
